id,full_name,description,owner_type,owner_url,owner_html_url,html_url,url,fork,created_at,updated_at,size,stargazers_count,language,has_issues,has_wiki,forks_count,forks,open_issues,watchers,timestamp_extract,commits,readme,contributors
29256552,CamaraDosDeputados/dados-abertos,"Repositório do serviço de Dados Abertos da Câmara. Consulte as ""Issues"" para atendimento a dúvidas e sugestões.",Organization,https://api.github.com/users/CamaraDosDeputados,https://github.com/CamaraDosDeputados,https://github.com/CamaraDosDeputados/dados-abertos,https://api.github.com/repos/CamaraDosDeputados/dados-abertos,False,2015-01-14T17:32:49Z,2019-11-05T21:58:29Z,6958,135,,True,True,7,7,203,135,1573082947,,,
39256926,dadosgovbr/catalogos-dados-brasil,Mapeamento de iniciativas (e catálogos) de dados abertos governamentais no Brasil.,Organization,https://api.github.com/users/dadosgovbr,https://github.com/dadosgovbr,https://github.com/dadosgovbr/catalogos-dados-brasil,https://api.github.com/repos/dadosgovbr/catalogos-dados-brasil,False,2015-07-17T14:02:34Z,2019-10-25T17:38:20Z,24,106,Python,True,True,34,34,0,106,1573082947,,,
73385196,prefeiturasp/dados-educacao,Análises e tutoriais das bases de dados abertos da Secretaria Municipal de Educação em formato aberto,Organization,https://api.github.com/users/prefeiturasp,https://github.com/prefeiturasp,https://github.com/prefeiturasp/dados-educacao,https://api.github.com/repos/prefeiturasp/dados-educacao,False,2016-11-10T13:35:40Z,2019-08-17T00:49:49Z,2737,48,Jupyter Notebook,True,True,18,18,1,48,1573082947,,,
49720381,dadosgovbr/aplicativos-dados-brasil,Mapeamento de aplicativos e visualizações que usam dados abertos governamentais no Brasil.,Organization,https://api.github.com/users/dadosgovbr,https://github.com/dadosgovbr,https://github.com/dadosgovbr/aplicativos-dados-brasil,https://api.github.com/repos/dadosgovbr/aplicativos-dados-brasil,False,2016-01-15T13:29:14Z,2019-06-16T17:26:35Z,2357,48,,True,True,9,9,1,48,1573082947,,,
20032900,dadosgovbr/kit,Kit de implementação do Plano de Dados Abertos,Organization,https://api.github.com/users/dadosgovbr,https://github.com/dadosgovbr,https://github.com/dadosgovbr/kit,https://api.github.com/repos/dadosgovbr/kit,False,2014-05-21T18:44:02Z,2019-09-19T19:56:14Z,2816,39,CSS,True,False,15,15,10,39,1573082947,,,
34538558,mapaslivres/localidades,Dados em formato aberto sobre municípios e unidades federativas do Brasil.,Organization,https://api.github.com/users/mapaslivres,https://github.com/mapaslivres,https://github.com/mapaslivres/localidades,https://api.github.com/repos/mapaslivres/localidades,False,2015-04-24T19:50:16Z,2019-10-02T19:55:42Z,6357,38,,True,False,14,14,6,38,1573082947,,,
198288124,odufrn/odufrn-downloader,Pacote para baixar os dados do portal de dados abertos da UFRN,Organization,https://api.github.com/users/odufrn,https://github.com/odufrn,https://github.com/odufrn/odufrn-downloader,https://api.github.com/repos/odufrn/odufrn-downloader,False,2019-07-22T19:19:52Z,2019-11-01T18:21:22Z,5088,29,Python,True,True,2,2,13,29,1573082947,,,
99498352,brasilopen/brasilopen,Projeto que reúne e padroniza os repositórios de dados abertos do Brasil.,Organization,https://api.github.com/users/brasilopen,https://github.com/brasilopen,https://github.com/brasilopen/brasilopen,https://api.github.com/repos/brasilopen/brasilopen,False,2017-08-06T16:14:08Z,2019-09-02T23:02:34Z,7,29,,True,True,2,2,6,29,1573082947,,,
23237993,vitorbaptista/dados-abertos-camara.gov.br,Dumps dos dados abertos disponíveis em http://www2.camara.leg.br/transparencia/dados-abertos,User,https://api.github.com/users/vitorbaptista,https://github.com/vitorbaptista,https://github.com/vitorbaptista/dados-abertos-camara.gov.br,https://api.github.com/repos/vitorbaptista/dados-abertos-camara.gov.br,False,2014-08-22T19:54:51Z,2019-07-15T11:07:09Z,20469,25,Python,True,True,3,3,0,25,1573082947,,,
4298345,jonny-data/conheca-seu-vereador,Desafio de Dados Abertos da Câmara Municipal de São Paulo,Organization,https://api.github.com/users/jonny-data,https://github.com/jonny-data,https://github.com/jonny-data/conheca-seu-vereador,https://api.github.com/repos/jonny-data/conheca-seu-vereador,False,2012-05-11T15:08:47Z,2019-10-11T21:14:49Z,1547,20,HTML,True,True,7,7,7,20,1573082947,,,
9631091,dadosgovbr/processo-participacao-social-inda,Documentação do processo de participação social na Infraestrutura Nacional de Dados Abertos.,Organization,https://api.github.com/users/dadosgovbr,https://github.com/dadosgovbr,https://github.com/dadosgovbr/processo-participacao-social-inda,https://api.github.com/repos/dadosgovbr/processo-participacao-social-inda,False,2013-04-23T19:11:40Z,2019-08-13T15:19:48Z,506,18,,True,True,12,12,0,18,1573082947,,,
88648214,npi-ufc-qxd/dados-abertos,,Organization,https://api.github.com/users/npi-ufc-qxd,https://github.com/npi-ufc-qxd,https://github.com/npi-ufc-qxd/dados-abertos,https://api.github.com/repos/npi-ufc-qxd/dados-abertos,False,2017-04-18T16:42:23Z,2018-11-03T12:50:36Z,11461,16,Jupyter Notebook,True,True,1,1,10,16,1573082947,,,
76583197,thefonseca/jogo-politico,Análise de posicionamento político utilizando a API de Dados Abertos da Câmara dos Deputados,User,https://api.github.com/users/thefonseca,https://github.com/thefonseca,https://github.com/thefonseca/jogo-politico,https://api.github.com/repos/thefonseca/jogo-politico,False,2016-12-15T17:59:46Z,2018-10-03T00:00:26Z,4240,15,Jupyter Notebook,True,True,7,7,0,15,1573082947,,,
87917509,zezente/opendata_aig_brazil,"Repositório com dados abertos sobre ocorrências aeronáuticas da aviação civil brasileira. Os dados extraídos já estão limpos e prontos para análises, no formato texto/cvs, separado por ~ (til).",User,https://api.github.com/users/zezente,https://github.com/zezente,https://github.com/zezente/opendata_aig_brazil,https://api.github.com/repos/zezente/opendata_aig_brazil,False,2017-04-11T09:48:07Z,2019-10-31T14:31:55Z,20404,15,R,True,True,5,5,0,15,1573082947,,,
176505271,augusto-herrmann/transparencia-dados-abertos-brasil,"A survey of Brazilian states' and municipalities' transparency and open data portals, obtained from several public data sources. Levantamento de portais estaduais e municipais de transparência e dados abertos, obtido a partir de diversas fontes de dados públicos.",User,https://api.github.com/users/augusto-herrmann,https://github.com/augusto-herrmann,https://github.com/augusto-herrmann/transparencia-dados-abertos-brasil,https://api.github.com/repos/augusto-herrmann/transparencia-dados-abertos-brasil,False,2019-03-19T12:17:35Z,2019-11-04T14:08:10Z,168,15,Python,True,True,1,1,5,15,1573082947,,,
19895876,inepdadosabertos/api,API de dados abertos para o INEP,Organization,https://api.github.com/users/inepdadosabertos,https://github.com/inepdadosabertos,https://github.com/inepdadosabertos/api,https://api.github.com/repos/inepdadosabertos/api,False,2014-05-17T20:45:05Z,2019-05-31T17:57:22Z,15704,14,,True,True,4,4,2,14,1573082947,,,
130277780,sigalei/api-camara-graphql,Uma implementação da API do portal de dados abertos utilizando GraphQL,Organization,https://api.github.com/users/sigalei,https://github.com/sigalei,https://github.com/sigalei/api-camara-graphql,https://api.github.com/repos/sigalei/api-camara-graphql,False,2018-04-19T22:09:36Z,2019-04-20T08:48:14Z,32,14,JavaScript,True,True,2,2,8,14,1573082947,,,
74465492,dadosgovbr/ckanext-dadosgovbr,Plugin / Tema do Portal Brasileiro de Dados Abertos do Governo Federal,Organization,https://api.github.com/users/dadosgovbr,https://github.com/dadosgovbr,https://github.com/dadosgovbr/ckanext-dadosgovbr,https://api.github.com/repos/dadosgovbr/ckanext-dadosgovbr,False,2016-11-22T11:22:49Z,2019-06-05T18:18:52Z,5061,13,HTML,True,True,5,5,1,13,1573082947,,,
138589072,dadosabertosrn/DadosAbertosRN,Esse é um repositório oficial do grupo Dados Abertos .RN,Organization,https://api.github.com/users/dadosabertosrn,https://github.com/dadosabertosrn,https://github.com/dadosabertosrn/DadosAbertosRN,https://api.github.com/repos/dadosabertosrn/DadosAbertosRN,False,2018-06-25T12:00:14Z,2019-10-08T00:14:35Z,48,13,,True,True,1,1,0,13,1573082947,,,
75962670,paulozip/acidentes-aereos,Um estudo de Data Science sobre acidentes aéreos no Brasil nos últimos 10 anos utilizando dados abertos do CENIPA,User,https://api.github.com/users/paulozip,https://github.com/paulozip,https://github.com/paulozip/acidentes-aereos,https://api.github.com/repos/paulozip/acidentes-aereos,False,2016-12-08T18:07:35Z,2019-06-10T01:31:34Z,2832,12,HTML,True,True,8,8,0,12,1573082947,,,
51756796,codigourbano/ocorrencias-transito-pmsp,Dados abertos sobre ocorrências de trânsito na cidade de São Paulo,Organization,https://api.github.com/users/codigourbano,https://github.com/codigourbano,https://github.com/codigourbano/ocorrencias-transito-pmsp,https://api.github.com/repos/codigourbano/ocorrencias-transito-pmsp,False,2016-02-15T13:20:17Z,2019-04-30T03:37:10Z,55097,12,,True,False,3,3,0,12,1573082947,,,
21168969,labhackercd/dados-abertos-2.0,"Projeto piloto para experimentar, testar e desenvolver processo, tecnologias, ferramentas, documentação e governança para fornecimento de dados abertos pela Câmara dos Deputados.",Organization,https://api.github.com/users/labhackercd,https://github.com/labhackercd,https://github.com/labhackercd/dados-abertos-2.0,https://api.github.com/repos/labhackercd/dados-abertos-2.0,False,2014-06-24T15:00:27Z,2018-05-17T14:02:04Z,23280,12,JavaScript,True,True,1,1,6,12,1573082947,,,
54055488,dadosgovbr/api-siconv,Código da API de dados abertos do Sistema de Gestão de Convênios e Contratos de Repasse (Siconv).,Organization,https://api.github.com/users/dadosgovbr,https://github.com/dadosgovbr,https://github.com/dadosgovbr/api-siconv,https://api.github.com/repos/dadosgovbr/api-siconv,False,2016-03-16T18:10:03Z,2019-09-20T12:14:08Z,6061,11,Python,True,True,7,7,0,11,1573082947,,,
81477396,transparenciahackday/dadosabertos.pt,O recurso para saber tudo sobre dados abertos em Portugal,Organization,https://api.github.com/users/transparenciahackday,https://github.com/transparenciahackday,https://github.com/transparenciahackday/dadosabertos.pt,https://api.github.com/repos/transparenciahackday/dadosabertos.pt,False,2017-02-09T17:43:49Z,2019-08-09T16:58:04Z,561,9,PHP,True,True,5,5,8,9,1573082947,,,
168520117,edumagol/Analise-Mapemaneto-Risco-Barragems-Brasil,"Projeto open source com objetivo principal de identificar os potenciais riscos das barragens. Foram criados mapas dinâmicos baseados em dados abertos, e aqui nesse documento, estamos disponibilizando nossas descobertas e os códigos que foram criados para essas análises, acreditamos que compartilhar essa construção/código pode estimular e acelerar outras iniciativas do mesmo tipo ao redor do Brasil.",User,https://api.github.com/users/edumagol,https://github.com/edumagol,https://github.com/edumagol/Analise-Mapemaneto-Risco-Barragems-Brasil,https://api.github.com/repos/edumagol/Analise-Mapemaneto-Risco-Barragems-Brasil,False,2019-01-31T12:17:16Z,2019-03-08T14:04:44Z,10007,9,Jupyter Notebook,True,True,2,2,1,9,1573082947,,,
121815293,abevieiramota/dataset-cnpj,Script para formatar em CSV os dados disponibilizados em http://idg.receita.fazenda.gov.br/orientacao/tributaria/cadastros/cadastro-nacional-de-pessoas-juridicas-cnpj/dados-abertos-do-cnpj,User,https://api.github.com/users/abevieiramota,https://github.com/abevieiramota,https://github.com/abevieiramota/dataset-cnpj,https://api.github.com/repos/abevieiramota/dataset-cnpj,False,2018-02-17T00:28:38Z,2019-05-14T19:25:03Z,183043,8,Python,True,True,2,2,2,8,1573082947,,,
150970023,ffknob/dados-abertos-elk,Uma tentativa de facilitação da utilização de dados abertos através do uso da  Elastic Stack.,User,https://api.github.com/users/ffknob,https://github.com/ffknob,https://github.com/ffknob/dados-abertos-elk,https://api.github.com/repos/ffknob/dados-abertos-elk,False,2018-09-30T13:32:55Z,2019-07-12T00:16:48Z,484,8,Shell,True,True,0,0,0,8,1573082947,,,
175814914,andreloc/open-data-assembleia-legislativa-ce,"Nesse projeto é realizado a raspagem, limpeza e análise dos dados da Assembléia Legislativa do Estado do Ceará visando extrair informações sobre o uso de verbas públicas pelos parlamentares no estado do Ceará. Os dados são obtidos da página de dados abertos da assembleia legislativa nesse link: https://www.al.ce.gov.br/index.php/transparencia/verba-de-desempenho-parlamentar.",User,https://api.github.com/users/andreloc,https://github.com/andreloc,https://github.com/andreloc/open-data-assembleia-legislativa-ce,https://api.github.com/repos/andreloc/open-data-assembleia-legislativa-ce,False,2019-03-15T12:19:47Z,2019-03-26T16:35:26Z,2491,8,HTML,True,True,0,0,0,8,1573082947,,,
129520407,centraldedados/parlamento,🏛🇵🇹 Dados Abertos da Assembleia da República,Organization,https://api.github.com/users/centraldedados,https://github.com/centraldedados,https://github.com/centraldedados/parlamento,https://api.github.com/repos/centraldedados/parlamento,False,2018-04-14T13:39:42Z,2019-08-18T14:47:00Z,555527,6,Python,True,True,3,3,3,6,1573082947,,,
75187872,sjcdigital/Dados-Abertos-SJC,Coleção de diversos dados raspados dos portais de transparência em formatos legíveis por máquina,Organization,https://api.github.com/users/sjcdigital,https://github.com/sjcdigital,https://github.com/sjcdigital/Dados-Abertos-SJC,https://api.github.com/repos/sjcdigital/Dados-Abertos-SJC,False,2016-11-30T13:08:58Z,2018-09-14T18:51:19Z,51,6,,True,True,0,0,2,6,1573082947,,,
185189954,campagnucci/dados-abertos-gov-br,Tratamento e análise de dados abertos do Governo Federal do Brasil,User,https://api.github.com/users/campagnucci,https://github.com/campagnucci,https://github.com/campagnucci/dados-abertos-gov-br,https://api.github.com/repos/campagnucci/dados-abertos-gov-br,False,2019-05-06T12:13:20Z,2019-08-23T11:29:19Z,481,6,Jupyter Notebook,True,True,0,0,0,6,1573082949,,,
128829209,danielmbicalho/Dados_repositorios_e_ferramentas,"Com este pequeno projeto pretendemos coletar repositórios de dados abertos, ferramentas e técnicas para trabalhar com análise de dados",User,https://api.github.com/users/danielmbicalho,https://github.com/danielmbicalho,https://github.com/danielmbicalho/Dados_repositorios_e_ferramentas,https://api.github.com/repos/danielmbicalho/Dados_repositorios_e_ferramentas,False,2018-04-09T20:22:00Z,2018-11-20T13:50:07Z,20,5,,True,True,9,9,0,5,1573082949,,,
165857850,FABdadosabertos/CENIPA,Repositório de Dados Abertos disponibilizados pelo Centro de Investigação e Prevenção de Acidentes Aeronáuticos (CENIPA),Organization,https://api.github.com/users/FABdadosabertos,https://github.com/FABdadosabertos,https://github.com/FABdadosabertos/CENIPA,https://api.github.com/repos/FABdadosabertos/CENIPA,False,2019-01-15T13:42:20Z,2019-11-01T19:57:11Z,2165,5,,True,True,4,4,1,5,1573082949,,,
13966611,luisleao/oicamara,"Hackathon da Câmara em 29/10/2013 - Aplicativo acessível para informações da Câmara Federal, com reconhecimento de voz e dados abertos",User,https://api.github.com/users/luisleao,https://github.com/luisleao,https://github.com/luisleao/oicamara,https://api.github.com/repos/luisleao/oicamara,False,2013-10-29T19:44:02Z,2018-12-08T22:39:04Z,2880,5,JavaScript,True,True,5,5,0,5,1573082949,,,
111123473,anaschwendler/workshop-bahia,I Workshop de Dados Abertos,User,https://api.github.com/users/anaschwendler,https://github.com/anaschwendler,https://github.com/anaschwendler/workshop-bahia,https://api.github.com/repos/anaschwendler/workshop-bahia,False,2017-11-17T16:07:41Z,2019-07-09T14:01:32Z,253,5,HTML,True,True,1,1,0,5,1573082949,,,
33840423,kerollaine/eaicongresso,Portal facilitador de acesso a dados governamentais abertos ,User,https://api.github.com/users/kerollaine,https://github.com/kerollaine,https://github.com/kerollaine/eaicongresso,https://api.github.com/repos/kerollaine/eaicongresso,False,2015-04-13T00:52:39Z,2018-10-03T00:41:13Z,16753,5,HTML,True,True,0,0,0,5,1573082949,,,
101760594,code-for-joinville/joinville-opendata.github.io,Site da comunidade de Dados Abertos de Joinville,Organization,https://api.github.com/users/code-for-joinville,https://github.com/code-for-joinville,https://github.com/code-for-joinville/joinville-opendata.github.io,https://api.github.com/repos/code-for-joinville/joinville-opendata.github.io,False,2017-08-29T12:49:24Z,2018-11-10T19:07:16Z,52,5,HTML,True,True,1,1,0,5,1573082949,,,
813115,tcm-ceara/apilayer,Aplicativo que facilita a criação de api de Dados Abertos,User,https://api.github.com/users/tcm-ceara,https://github.com/tcm-ceara,https://github.com/tcm-ceara/apilayer,https://api.github.com/repos/tcm-ceara/apilayer,False,2010-08-02T20:29:14Z,2014-01-01T21:29:58Z,7724,5,PHP,True,True,0,0,0,5,1573082949,,,
170779816,Vnicius/dados-pb,Scripts para realizar o download dos dados abertos do estado da Paraíba disponíveis em https://dados.pb.gov.br/,User,https://api.github.com/users/Vnicius,https://github.com/Vnicius,https://github.com/Vnicius/dados-pb,https://api.github.com/repos/Vnicius/dados-pb,False,2019-02-15T00:53:53Z,2019-09-06T01:49:12Z,86,5,Python,True,True,0,0,0,5,1573082949,,,
63019024,peterleiva/CNES-API,API para empacotar os dados abertos do governo referente ao CNES (DATASUS). Prove dados de estabelecimentos de saúde,User,https://api.github.com/users/peterleiva,https://github.com/peterleiva,https://github.com/peterleiva/CNES-API,https://api.github.com/repos/peterleiva/CNES-API,False,2016-07-10T21:22:46Z,2019-10-18T09:48:58Z,17040,5,Ruby,True,True,1,1,0,5,1573082949,,,
14311987,juliohenriquerocha/cidade-mapeada-lsi,Aplicativo participante do 2º Encontro Nacional de Dados Abertos. Desenvolvido pelo Laboratório de Sistema de Informação (LSI/SINBAD),User,https://api.github.com/users/juliohenriquerocha,https://github.com/juliohenriquerocha,https://github.com/juliohenriquerocha/cidade-mapeada-lsi,https://api.github.com/repos/juliohenriquerocha/cidade-mapeada-lsi,False,2013-11-11T20:14:18Z,2018-04-10T17:35:42Z,516,5,CSS,True,True,1,1,1,5,1573082949,,,
73896811,Dayof/OpenData_BolsaFamilia,Projeto final da matéria Banco de Dados da UnB. O projeto coleta dados abertos sobre o bolsa família e realiza CRUD e algumas outras operações sobre os dados de um determinado mês/ano.,User,https://api.github.com/users/Dayof,https://github.com/Dayof,https://github.com/Dayof/OpenData_BolsaFamilia,https://api.github.com/repos/Dayof/OpenData_BolsaFamilia,False,2016-11-16T07:53:42Z,2018-06-04T22:33:58Z,4359,5,Python,True,True,0,0,0,5,1573082949,,,
58408803,sergioamorim/lattes_mining,Extrator de dados do Lattes para a disciplina Dados Abertos Conectados - IC/UFAL 2015.2,User,https://api.github.com/users/sergioamorim,https://github.com/sergioamorim,https://github.com/sergioamorim/lattes_mining,https://api.github.com/repos/sergioamorim/lattes_mining,False,2016-05-09T21:15:57Z,2019-11-01T11:08:51Z,28543,4,Python,True,True,5,5,0,4,1573082949,,,
154009338,pyladiespb-org/minicurso-analise-descritiva-dados-abertos,Curso de análise descritiva com dados abertos e Python. Vamos mostrar como responder perguntas a partir da pesquisa e análise de dados estruturados disponíveis na WEB,Organization,https://api.github.com/users/pyladiespb-org,https://github.com/pyladiespb-org,https://github.com/pyladiespb-org/minicurso-analise-descritiva-dados-abertos,https://api.github.com/repos/pyladiespb-org/minicurso-analise-descritiva-dados-abertos,False,2018-10-21T13:07:27Z,2019-11-06T21:21:56Z,786,4,Jupyter Notebook,True,True,4,4,0,4,1573082949,,,
138945801,ReciHub/Dados-Abertos-Recife,Repositório com os Dados abertos da cidade do Recife - Pernambuco - Brasil :brazil:,Organization,https://api.github.com/users/ReciHub,https://github.com/ReciHub,https://github.com/ReciHub/Dados-Abertos-Recife,https://api.github.com/repos/ReciHub/Dados-Abertos-Recife,False,2018-06-28T00:11:27Z,2019-10-03T17:30:52Z,1752,4,,True,True,1,1,0,4,1573082949,,,
135935271,isweluiz/verba_indenizatoria__cldf,Análise de dados sobre dados abertos referente a verba indenizatória dos deputados da CLDF,User,https://api.github.com/users/isweluiz,https://github.com/isweluiz,https://github.com/isweluiz/verba_indenizatoria__cldf,https://api.github.com/repos/isweluiz/verba_indenizatoria__cldf,False,2018-06-03T19:47:24Z,2019-02-28T16:23:43Z,1878,4,Jupyter Notebook,True,True,1,1,0,4,1573082949,,,
159856416,alvarofpp/analise-ufrn-python-day-2018,Minicurso de analise dos dados abertos da UFRN ministrado no Python Day 2018 em Natal-RN,User,https://api.github.com/users/alvarofpp,https://github.com/alvarofpp,https://github.com/alvarofpp/analise-ufrn-python-day-2018,https://api.github.com/repos/alvarofpp/analise-ufrn-python-day-2018,False,2018-11-30T17:24:13Z,2019-09-17T13:12:58Z,28837,4,Jupyter Notebook,True,True,0,0,0,4,1573082949,,,
56625707,mapaslivres/zonas-eleitorais,Dados sobre zonas eleitorais brasileiras em formato aberto,Organization,https://api.github.com/users/mapaslivres,https://github.com/mapaslivres,https://github.com/mapaslivres/zonas-eleitorais,https://api.github.com/repos/mapaslivres/zonas-eleitorais,False,2016-04-19T19:28:33Z,2018-12-01T23:22:53Z,12762,4,,True,True,1,1,2,4,1573082949,,,
4306387,nilzao/cmspwiki,Bot para publicar dados abertos disponibilizados pela camara de São Paulo.,User,https://api.github.com/users/nilzao,https://github.com/nilzao,https://github.com/nilzao/cmspwiki,https://api.github.com/repos/nilzao/cmspwiki,False,2012-05-12T12:36:24Z,2019-11-04T22:54:59Z,9273,3,PHP,True,True,3,3,0,3,1573082949,,,
136625646,planejamentoGovBr/PDA-institucional-MP,Repositório versionado do Plano de Dados Abertos do Ministério do Planejamento,Organization,https://api.github.com/users/planejamentoGovBr,https://github.com/planejamentoGovBr,https://github.com/planejamentoGovBr/PDA-institucional-MP,https://api.github.com/repos/planejamentoGovBr/PDA-institucional-MP,False,2018-06-08T13:55:24Z,2018-10-15T14:05:45Z,3668,3,CSS,False,False,3,3,0,3,1573082949,,,
23047939,okfn-brasil/gastos_abertos_dados,Repositório dos dados em estado bruto utilizados no projeto Gastos Abertos,Organization,https://api.github.com/users/okfn-brasil,https://github.com/okfn-brasil,https://github.com/okfn-brasil/gastos_abertos_dados,https://api.github.com/repos/okfn-brasil/gastos_abertos_dados,False,2014-08-17T19:01:09Z,2017-11-20T12:43:11Z,110967,3,Jupyter Notebook,True,True,2,2,1,3,1573082949,,,
155714466,kheronn/transparencia-pr,Projeto em Angular 7 e Rest Api com Dados Abertos,User,https://api.github.com/users/kheronn,https://github.com/kheronn,https://github.com/kheronn/transparencia-pr,https://api.github.com/repos/kheronn/transparencia-pr,False,2018-11-01T12:52:06Z,2018-11-23T12:30:14Z,427,3,TypeScript,True,True,2,2,0,3,1573082949,,,
200083985,nymarya/prf_api,Pacote para baixar os dados do portal de dados abertos da Polícia Rodoviária Federal,User,https://api.github.com/users/nymarya,https://github.com/nymarya,https://github.com/nymarya/prf_api,https://api.github.com/repos/nymarya/prf_api,False,2019-08-01T16:23:48Z,2019-09-30T17:07:13Z,89,3,Python,True,True,2,2,4,3,1573082949,,,
104599042,marceloandriolli/informacao-salva,Analise de dados aberto sobre suicídio no Brasil,User,https://api.github.com/users/marceloandriolli,https://github.com/marceloandriolli,https://github.com/marceloandriolli/informacao-salva,https://api.github.com/repos/marceloandriolli/informacao-salva,False,2017-09-23T21:05:24Z,2018-10-31T21:08:09Z,318,3,Jupyter Notebook,True,True,2,2,0,3,1573082949,,,
11057740,acvilarim/politicAPI,API voltada para dados abertos da politica,User,https://api.github.com/users/acvilarim,https://github.com/acvilarim,https://github.com/acvilarim/politicAPI,https://api.github.com/repos/acvilarim/politicAPI,False,2013-06-29T18:59:11Z,2018-10-03T12:44:30Z,1228,3,JavaScript,True,True,0,0,8,3,1573082949,,,
110362272,geovannyAvelar/Dados-Abertos-Campeonato-Brasileiro,Dados das partidas do Campeonato Brasileiro de Futebol da Série A desde 2003,User,https://api.github.com/users/geovannyAvelar,https://github.com/geovannyAvelar,https://github.com/geovannyAvelar/Dados-Abertos-Campeonato-Brasileiro,https://api.github.com/repos/geovannyAvelar/Dados-Abertos-Campeonato-Brasileiro,False,2017-11-11T16:45:58Z,2019-08-12T21:25:14Z,361,3,,True,False,0,0,0,3,1573082949,,,
70362990,GETIPUSP/dadosabertosnasaude,Repositório de dados abertos na saúde brasileira. Foco para a área de oncologia.,Organization,https://api.github.com/users/GETIPUSP,https://github.com/GETIPUSP,https://github.com/GETIPUSP/dadosabertosnasaude,https://api.github.com/repos/GETIPUSP/dadosabertosnasaude,False,2016-10-08T23:27:32Z,2018-11-19T19:45:29Z,19,3,,True,True,1,1,0,3,1573082949,,,
47273197,CodeForCuritiba/dadosabertos_prefs,Espaço para fazer e seguir os pedidos de Dados Abertos com a prefeitura,Organization,https://api.github.com/users/CodeForCuritiba,https://github.com/CodeForCuritiba,https://github.com/CodeForCuritiba/dadosabertos_prefs,https://api.github.com/repos/CodeForCuritiba/dadosabertos_prefs,False,2015-12-02T16:21:37Z,2018-12-20T17:00:19Z,0,3,,True,True,0,0,9,3,1573082949,,,
155744537,djalmaaraujo/dadosabertos-cnpj-converter,"Script para converter dados abertos de CNPJ em formato de SQL ou CSV. Captura o Nome da Empresa, CNPJ e Estado.",User,https://api.github.com/users/djalmaaraujo,https://github.com/djalmaaraujo,https://github.com/djalmaaraujo/dadosabertos-cnpj-converter,https://api.github.com/repos/djalmaaraujo/dadosabertos-cnpj-converter,False,2018-11-01T16:34:21Z,2019-02-05T12:23:21Z,4,3,JavaScript,True,True,0,0,0,3,1573082949,,,
