id,full_name,description,owner_type,owner_url,owner_html_url,html_url,url,fork,created_at,updated_at,size,stargazers_count,language,has_issues,has_wiki,forks_count,forks,open_issues,watchers,timestamp_extract,commits,readme,contributors
39032112,rodrigosantana/Curso_R_Intro_UNIVALI_2015,R: uma ferramenta de código aberto para análise de dados,User,https://api.github.com/users/rodrigosantana,https://github.com/rodrigosantana,https://github.com/rodrigosantana/Curso_R_Intro_UNIVALI_2015,https://api.github.com/repos/rodrigosantana/Curso_R_Intro_UNIVALI_2015,False,2015-07-13T19:13:55Z,2015-07-16T00:49:41Z,30408,0,TeX,True,True,0,0,0,0,1573082968,,,
149638808,Danhfg/Analise-dos-Dados-Abertos-da-C-mara-de-Deputados,,User,https://api.github.com/users/Danhfg,https://github.com/Danhfg,https://github.com/Danhfg/Analise-dos-Dados-Abertos-da-C-mara-de-Deputados,https://api.github.com/repos/Danhfg/Analise-dos-Dados-Abertos-da-C-mara-de-Deputados,False,2018-09-20T16:29:08Z,2018-09-24T03:07:16Z,46,0,Python,True,True,0,0,0,0,1573082968,,,
96199410,vtlg/angulegis,"Projeto com o objetivo de capturar informações do site da câmara dos deputados. Os dados a serem consumidos serão provenientes dos serviços disponibilizados na área ""dados abertos"".",User,https://api.github.com/users/vtlg,https://github.com/vtlg,https://github.com/vtlg/angulegis,https://api.github.com/repos/vtlg/angulegis,False,2017-07-04T09:15:38Z,2017-07-04T09:47:57Z,32663,0,TypeScript,True,True,0,0,0,0,1573082968,,,
107035542,pboueke/ficha-espacial,:stars: Projeto que visa realizar o cruzamento de dados eleitorais brasileiros com indicadores sociais a partir de dados abertos e geolocalizados,User,https://api.github.com/users/pboueke,https://github.com/pboueke,https://github.com/pboueke/ficha-espacial,https://api.github.com/repos/pboueke/ficha-espacial,False,2017-10-15T17:56:06Z,2018-12-20T11:19:45Z,13685,0,JavaScript,True,True,0,0,0,0,1573082968,,,
195320222,jjanuario/datamining,Caso de estudo onde analiso dados abertos obtidos via portal da transparencia e outras fontes de estudos. Dados disponiveis junto ao notebook.,User,https://api.github.com/users/jjanuario,https://github.com/jjanuario,https://github.com/jjanuario/datamining,https://api.github.com/repos/jjanuario/datamining,False,2019-07-05T01:39:26Z,2019-07-06T23:16:07Z,2459,0,Jupyter Notebook,True,True,0,0,0,0,1573082968,,,
155266744,wagner-goncalves/srcidadao-coletor-senado,Biblioteca para Download de XMLs dos Serviços de Dados Abertos do Senado Federal e Processamento dos XMLs para um banco de Dados MySQL.,User,https://api.github.com/users/wagner-goncalves,https://github.com/wagner-goncalves,https://github.com/wagner-goncalves/srcidadao-coletor-senado,https://api.github.com/repos/wagner-goncalves/srcidadao-coletor-senado,False,2018-10-29T19:11:10Z,2018-10-29T19:20:34Z,51,0,PHP,True,True,0,0,0,0,1573082968,,,
27477143,antonivargas/desafio-camara,Projeto do desafio de aplicação com dados abertos do governo federal da disciplina de GDSE-TSI-IFC,User,https://api.github.com/users/antonivargas,https://github.com/antonivargas,https://github.com/antonivargas/desafio-camara,https://api.github.com/repos/antonivargas/desafio-camara,False,2014-12-03T08:27:31Z,2015-02-03T19:01:33Z,2428,0,PHP,True,True,0,0,0,0,1573082968,,,
14479593,armandobs14/SaudeBR,"Projeto destinado ao campeonato de dados abertos, esta aplicação usa conceitos se web semântica para a melhor integração entre os dados, provendo informações mais ricas aos usuários",User,https://api.github.com/users/armandobs14,https://github.com/armandobs14,https://github.com/armandobs14/SaudeBR,https://api.github.com/repos/armandobs14/SaudeBR,False,2013-11-18T01:38:06Z,2013-11-21T02:05:51Z,65528,0,CSS,True,True,0,0,0,0,1573082968,,,
46597741,oliveirabrunoa/ConsultaTempo,Aplicativo que realiza a consulta da situação do tempo em Salvador a partir de um servidor de dados abertos,User,https://api.github.com/users/oliveirabrunoa,https://github.com/oliveirabrunoa,https://github.com/oliveirabrunoa/ConsultaTempo,https://api.github.com/repos/oliveirabrunoa/ConsultaTempo,False,2015-11-21T02:30:28Z,2015-11-21T02:32:42Z,77,0,Java,True,True,0,0,0,0,1573082968,,,
97181457,tiagovizoto/OperacaoUniEsquina,"Operação UniEsquina tem como objetivo de desenvolver uma plataforma que encontrará as piores UniQualquerMerda, utilizando de dados abertos. ",User,https://api.github.com/users/tiagovizoto,https://github.com/tiagovizoto,https://github.com/tiagovizoto/OperacaoUniEsquina,https://api.github.com/repos/tiagovizoto/OperacaoUniEsquina,False,2017-07-14T01:53:46Z,2017-07-14T01:53:46Z,0,0,,True,True,0,0,0,0,1573082970,,,
216956926,kevenbmx/DYN_MST_BRSE,"Redes dinâmicas de Correlção  do mercado financeiro brasileiro, por meio de dados abertos provinientes da B3 por meio do Pyspark",User,https://api.github.com/users/kevenbmx,https://github.com/kevenbmx,https://github.com/kevenbmx/DYN_MST_BRSE,https://api.github.com/repos/kevenbmx/DYN_MST_BRSE,False,2019-10-23T03:06:59Z,2019-11-06T17:27:56Z,34,0,Jupyter Notebook,True,True,1,1,0,0,1573082970,,,
21104192,luiscape/congresso_aberto_viz,Experimentos com visualizações com o banco de dados do Congresso Aberto. ,User,https://api.github.com/users/luiscape,https://github.com/luiscape,https://github.com/luiscape/congresso_aberto_viz,https://api.github.com/repos/luiscape/congresso_aberto_viz,False,2014-06-22T20:16:00Z,2014-06-22T20:16:01Z,0,0,,True,True,0,0,0,0,1573082970,,,
105315824,glauberferreira/exames-selecao-ifal,"O objetivo neste projeto é converter os resultados dos Exames de Seleção do IFAL disponíveis em formato binário (PDF) para formatos abertos (e.g CSV, JSON) e, em seguida, integrar com a publicação no Portal de Dados Abertos do IFAL.",User,https://api.github.com/users/glauberferreira,https://github.com/glauberferreira,https://github.com/glauberferreira/exames-selecao-ifal,https://api.github.com/repos/glauberferreira/exames-selecao-ifal,False,2017-09-29T20:48:11Z,2017-09-29T21:02:56Z,30,0,Batchfile,True,True,0,0,0,0,1573082970,,,
204559770,lucasknj/Projeto-Capstone,Projeto para prever nota do atendimento da empresa ao cliente. Foram utilizados dados do Portal Brasileiro de Dados Abertos (link para acesso: http://dados.gov.br/dataset/reclamacoes-do-consumidor-gov-br1).,User,https://api.github.com/users/lucasknj,https://github.com/lucasknj,https://github.com/lucasknj/Projeto-Capstone,https://api.github.com/repos/lucasknj/Projeto-Capstone,False,2019-08-26T20:53:13Z,2019-08-26T20:53:46Z,607,0,Jupyter Notebook,True,True,0,0,0,0,1573082970,,,
188754885,Arnaldoeloi/discentes-ufrn-2009-2019-analise-dados,Uma breve análise sobre o que os dados abertos da UFRN nos dizem quanto às diferenças étnicas e de sexo na UFRN entre os anos de 2009 e 2019.,User,https://api.github.com/users/Arnaldoeloi,https://github.com/Arnaldoeloi,https://github.com/Arnaldoeloi/discentes-ufrn-2009-2019-analise-dados,https://api.github.com/repos/Arnaldoeloi/discentes-ufrn-2009-2019-analise-dados,False,2019-05-27T02:04:17Z,2019-05-27T02:05:06Z,1105,0,Jupyter Notebook,True,True,0,0,0,0,1573082970,,,
91734800,oxstormrider/vancrime,"Um breve exercício envolvendo Extração, Tradução, Carga e Visualização dos dados abertos sobre os crimes ocorridos na cidade de Vancouver(Canadá).",User,https://api.github.com/users/oxstormrider,https://github.com/oxstormrider,https://github.com/oxstormrider/vancrime,https://api.github.com/repos/oxstormrider/vancrime,False,2017-05-18T20:26:06Z,2017-05-18T22:29:44Z,7642,0,Ruby,True,True,0,0,0,0,1573082970,,,
136745988,italo-batista/como-vota-deputado,Lib que empacota endpoints de votações da API de dados abertos da Câmara dos Deputados (Python 3.x) [W.I.P.],User,https://api.github.com/users/italo-batista,https://github.com/italo-batista,https://github.com/italo-batista/como-vota-deputado,https://api.github.com/repos/italo-batista/como-vota-deputado,False,2018-06-09T17:55:50Z,2018-09-07T18:17:24Z,28,0,Python,True,True,0,0,0,0,1573082970,,,
192833937,geovannyAvelar/Homicidios-dolosos-Sao-Paulo-2019,Análise de dados abertos relativos a boletins de ocorrências de homicídios dolosos no estado de São Paulo no ano de 2019,User,https://api.github.com/users/geovannyAvelar,https://github.com/geovannyAvelar,https://github.com/geovannyAvelar/Homicidios-dolosos-Sao-Paulo-2019,https://api.github.com/repos/geovannyAvelar/Homicidios-dolosos-Sao-Paulo-2019,False,2019-06-20T02:23:21Z,2019-06-20T02:35:52Z,773,0,Jupyter Notebook,True,True,0,0,0,0,1573082970,,,
202390919,osamuelalmeid/Analise-Sobre-Acidentes-Aereos-no-Brasil,"Análise de acidentes aéreos no Brasil durante os últimos 10 anos, utilizando dados abertos disponibilizados pelo CENIPA. Estudo de Data Science.",User,https://api.github.com/users/osamuelalmeid,https://github.com/osamuelalmeid,https://github.com/osamuelalmeid/Analise-Sobre-Acidentes-Aereos-no-Brasil,https://api.github.com/repos/osamuelalmeid/Analise-Sobre-Acidentes-Aereos-no-Brasil,False,2019-08-14T16:52:43Z,2019-08-14T17:12:58Z,1700,0,HTML,True,True,0,0,0,0,1573082970,,,
163344098,SabrinyBezerra/Dashboard,Análise dos Dados Abertos do Governo Federal – Um Dashbord para Visualização dos Registros e Causas de Acidentes nas Rodovias Federais do Brasil ,User,https://api.github.com/users/SabrinyBezerra,https://github.com/SabrinyBezerra,https://github.com/SabrinyBezerra/Dashboard,https://api.github.com/repos/SabrinyBezerra/Dashboard,False,2018-12-27T23:19:39Z,2018-12-27T23:23:14Z,165,0,JavaScript,True,True,0,0,0,0,1573082970,,,
82625780,inacior/asteroids,"WebApp que consome os dados abertos da NASA e informa os asteróides detectados no dia, com informações detalhadas sobre cada um.",User,https://api.github.com/users/inacior,https://github.com/inacior,https://github.com/inacior/asteroids,https://api.github.com/repos/inacior/asteroids,False,2017-02-21T02:17:39Z,2017-02-21T02:32:49Z,1239,0,JavaScript,True,True,0,0,1,0,1573082970,,,
135726621,rodrigoferrazazevedo/ubs-rails,"Web API that lists brazilian health basics units based on data from ""Portal Brasileiro de Dados Abertos"" (Brazilian Open Data Portal)",User,https://api.github.com/users/rodrigoferrazazevedo,https://github.com/rodrigoferrazazevedo,https://github.com/rodrigoferrazazevedo/ubs-rails,https://api.github.com/repos/rodrigoferrazazevedo/ubs-rails,False,2018-06-01T14:18:06Z,2019-02-28T14:34:26Z,2562,0,Ruby,True,True,0,0,0,0,1573082970,,,
143268686,SabrinyBezerra/TCC,Análise dos Dados Abertos do Governo Federal – Um Dashbord para Visualização dos Registros e Causas de Acidentes nas Rodovias Federais do Brasil,User,https://api.github.com/users/SabrinyBezerra,https://github.com/SabrinyBezerra,https://github.com/SabrinyBezerra/TCC,https://api.github.com/repos/SabrinyBezerra/TCC,False,2018-08-02T08:55:17Z,2018-10-05T17:52:58Z,185,0,JavaScript,True,True,0,0,0,0,1573082970,,,
20642591,ppKrauss/getcsv_stdOpenGov,"Classe PHP para padronização parcial dos dados e do uso de fgetcsv(), em contextos de recuperação de dados brutos do governo aberto",User,https://api.github.com/users/ppKrauss,https://github.com/ppKrauss,https://github.com/ppKrauss/getcsv_stdOpenGov,https://api.github.com/repos/ppKrauss/getcsv_stdOpenGov,False,2014-06-09T10:25:34Z,2014-06-22T20:36:16Z,0,0,,True,True,0,0,0,0,1573082970,,,
153911892,juliafealves/leda-tabela-hash-aberto,:hash: Algoritmos Tabela Hash de Endereçamento Aberto. Desenvolvido para o roteiro R09 do Laboratório de Estrutura de Dados (UFCG).,User,https://api.github.com/users/juliafealves,https://github.com/juliafealves,https://github.com/juliafealves/leda-tabela-hash-aberto,https://api.github.com/repos/juliafealves/leda-tabela-hash-aberto,False,2018-10-20T14:06:24Z,2018-10-20T16:17:28Z,23,0,Java,True,True,0,0,0,0,1573082970,,,
171987864,BrunoMoriB/stockmarket-manager,"backend - Gerenciador de operações de ações (trades) e de informações das empresas com capital aberto - Dados financeiros, indicadores, etc.",User,https://api.github.com/users/BrunoMoriB,https://github.com/BrunoMoriB,https://github.com/BrunoMoriB/stockmarket-manager,https://api.github.com/repos/BrunoMoriB/stockmarket-manager,False,2019-02-22T03:25:55Z,2019-06-27T01:52:45Z,38,0,Java,True,True,0,0,0,0,1573082970,,,
38876693,hiperorganicos/openlab_datavis,Visualizações para a rede de integrantes e troca de dados desenvolvidas durante cada edição do laboratório aberto.,Organization,https://api.github.com/users/hiperorganicos,https://github.com/hiperorganicos,https://github.com/hiperorganicos/openlab_datavis,https://api.github.com/repos/hiperorganicos/openlab_datavis,False,2015-07-10T11:15:41Z,2015-07-10T11:38:10Z,544,0,JavaScript,True,True,0,0,1,0,1573082970,,,
43135825,code-like-a-girl/hacker-cidadao-3.0,[description in Portuguese] Aplicação desenvolvida na categoria diário oficial com dados abertos da Prefeitura do Recife para o hackathon Hacker Cidadão 3.0 - Campus Party Recife 2015. Mais informações em http://dados.recife.pe.gov.br/hacker-cidadao-3,Organization,https://api.github.com/users/code-like-a-girl,https://github.com/code-like-a-girl,https://github.com/code-like-a-girl/hacker-cidadao-3.0,https://api.github.com/repos/code-like-a-girl/hacker-cidadao-3.0,False,2015-09-25T11:25:41Z,2015-09-25T17:58:58Z,1452,0,JavaScript,True,True,0,0,0,0,1573082970,,,
159745160,NastyaCodingBunny/PYTHON---SIMULADOR-DE-CADASTRO,"SIMULA UM PAINEL DE CADASTRO, VC COLOCA OS DADOS DA PESSOA, VOCÊ PODE MONTAR E VISUALIZAR OS DADOS, VOCÊ PODE GERAR UM ARQUIVO CONTENDO OS DADOS MONTADOS E ORGANIZADOS E QUE PODE SER ABERTO E EDITADO COM BLOCO DE NOTAS",User,https://api.github.com/users/NastyaCodingBunny,https://github.com/NastyaCodingBunny,https://github.com/NastyaCodingBunny/PYTHON---SIMULADOR-DE-CADASTRO,https://api.github.com/repos/NastyaCodingBunny/PYTHON---SIMULADOR-DE-CADASTRO,False,2018-11-30T00:23:23Z,2018-11-30T00:24:49Z,2,0,Python,True,True,0,0,0,0,1573082970,,,
142165595,wharborges/analiseES,Este repositório é uma abordagem em análise de dados abertos do portal https://transparencia.es.gov.br/DadosAbertos - expressa o desejo de um capixaba ávido por analytics! Seja Bem-vindo!,User,https://api.github.com/users/wharborges,https://github.com/wharborges,https://github.com/wharborges/analiseES,https://api.github.com/repos/wharborges/analiseES,False,2018-07-24T13:54:08Z,2018-07-24T13:54:08Z,0,0,,True,True,0,0,0,0,1573082970,,,
168254018,VRPazdeJesus/multas-ibama,"Um script que quando rodado, acessa os Dados Abertos do Governo, para buscar as multas referente a Fauna, Flora, Pesca e Outros, aplicadas pelo IBAMA no estado do Acre e gera 4 tabelas em CSV",User,https://api.github.com/users/VRPazdeJesus,https://github.com/VRPazdeJesus,https://github.com/VRPazdeJesus/multas-ibama,https://api.github.com/repos/VRPazdeJesus/multas-ibama,False,2019-01-30T00:50:49Z,2019-03-24T21:27:35Z,117,0,Python,True,True,0,0,0,0,1573082970,,,
86646585,decosoares/diariasservidoresalagoas,Projeto de aplicação web que utilizado os dados abertos do portal da transparência de alagoas para fornecer informações a população a respeito do repasse dos recursos gastos com diárias aos servidores estaduais,User,https://api.github.com/users/decosoares,https://github.com/decosoares,https://github.com/decosoares/diariasservidoresalagoas,https://api.github.com/repos/decosoares/diariasservidoresalagoas,False,2017-03-30T01:45:13Z,2017-03-31T07:22:28Z,52505,0,PHP,True,True,0,0,0,0,1573082970,,,
19987976,leonardocouy/MaisCopa,"Projeto feito em Python + App Engine + Tekton + AngularJS
.Trabalho usando Dados Abertos da Copa do Mundo.
 Aluno: Leonardo Flores Couy
 Professor: Marcelo Brito 
 Matéria: Sistemas Gerenciadores de Banco 
 Universidade Presidente Antonio Carlos - 2014.",User,https://api.github.com/users/leonardocouy,https://github.com/leonardocouy,https://github.com/leonardocouy/MaisCopa,https://api.github.com/repos/leonardocouy/MaisCopa,False,2014-05-20T16:12:18Z,2015-09-01T19:52:31Z,268,0,JavaScript,True,True,0,0,0,0,1573082970,,,
139219659,Idiego2/Dashboard-PHP-e-MySQL,"Esse Dashboard feito para captação de dados do solo de sistemas agrícolas e disponibilizar online, com armazenamento dos dados para analise , utilizando Arduino e ESP8266. ( Projeto pausado - não completo - aberto a sugestões e atualizações)",User,https://api.github.com/users/Idiego2,https://github.com/Idiego2,https://github.com/Idiego2/Dashboard-PHP-e-MySQL,https://api.github.com/repos/Idiego2/Dashboard-PHP-e-MySQL,False,2018-06-30T04:41:07Z,2018-06-30T04:48:17Z,299,0,PHP,True,True,0,0,0,0,1573082970,,,
216034187,OLIVEIRAFAEL/GoogleFinance,"Utilizando RPA com UiPath, construímos um bot que executa uma busca simples sobre os dados financeiros de empresas com capital aberto no Google Finance.",User,https://api.github.com/users/OLIVEIRAFAEL,https://github.com/OLIVEIRAFAEL,https://github.com/OLIVEIRAFAEL/GoogleFinance,https://api.github.com/repos/OLIVEIRAFAEL/GoogleFinance,False,2019-10-18T13:48:16Z,2019-10-18T14:34:48Z,3690,0,,True,True,0,0,0,0,1573082970,,,
163692342,lodovikoa/convencao_financeiroapi,"API Restful para obter dados financeiros em aberto de um ministro, bem como registro de boletos de acordo com a seleção de parcelas escolhida pelo ministro usuário.",User,https://api.github.com/users/lodovikoa,https://github.com/lodovikoa,https://github.com/lodovikoa/convencao_financeiroapi,https://api.github.com/repos/lodovikoa/convencao_financeiroapi,False,2018-12-31T19:15:36Z,2019-07-31T01:24:06Z,75,0,Java,True,True,0,0,0,0,1573082970,,,
176795969,WelitonAmartins/Config-Redis-docker,"Configurando Redis com docker. O Redis é um armazenamento de estrutura de dados de chave-valor de código aberto e na memória. Os principais casos de uso do Redis incluem cache, gerenciamento de sessões, PUB/SUB e classificações. ",User,https://api.github.com/users/WelitonAmartins,https://github.com/WelitonAmartins,https://github.com/WelitonAmartins/Config-Redis-docker,https://api.github.com/repos/WelitonAmartins/Config-Redis-docker,False,2019-03-20T18:39:04Z,2019-09-08T02:13:26Z,11,0,Java,True,True,0,0,0,0,1573082970,,,
52807998,rafaelimai/rbmc_batch_proc,O Processador de Dados de Posição da RBMC é um programa de código aberto que visa servir de interface para o processamento de grandes quantidades de dados de observações provenientes da RBMC - Rede Brasileira de Monitoramento Contínuo do IBGE (Instituto Brasileiro de Geografia e Estatística).,User,https://api.github.com/users/rafaelimai,https://github.com/rafaelimai,https://github.com/rafaelimai/rbmc_batch_proc,https://api.github.com/repos/rafaelimai/rbmc_batch_proc,False,2016-02-29T17:01:00Z,2016-02-29T17:01:00Z,15,0,,True,True,0,0,0,0,1573082970,,,
137143652,bicudorafa/Projeto_R_WorldBankAPI_Analysis,"Começou como um projeto para análise de dados usando a API do WorldBank. No entanto, após conseguir alguns dados e realizar uma animação interativa com o pacote plot.ly, findei por não seguir para um próximo ponto da análise. Estou totalmente aberto a novas sugestões de abordagem.",User,https://api.github.com/users/bicudorafa,https://github.com/bicudorafa,https://github.com/bicudorafa/Projeto_R_WorldBankAPI_Analysis,https://api.github.com/repos/bicudorafa/Projeto_R_WorldBankAPI_Analysis,False,2018-06-13T00:52:50Z,2019-01-04T19:12:32Z,9,0,R,True,True,1,1,0,0,1573082970,,,
25574214,AdemirSJRP/CSharp_BasicFramework,"Framework básico em C# Framework 2.0 que pode ser acoplado a diversos tipos de projetos. Contém classes para Criptografia de dados, impressão em ECFs (impressoras fiscais), compactação de arquivos, ftp, tratamento de imagens, impressão em modo texto (impressoras lpt/com), validação de dados, números, arredondamento, contas e outros. Aberto a todo público para colaboração.",User,https://api.github.com/users/AdemirSJRP,https://github.com/AdemirSJRP,https://github.com/AdemirSJRP/CSharp_BasicFramework,https://api.github.com/repos/AdemirSJRP/CSharp_BasicFramework,False,2014-10-22T09:53:04Z,2018-11-25T22:54:14Z,1739,0,,False,True,0,0,0,0,1573082971,,,
72588412,renematos79/redis,"O REDIS e é um projeto aberto e serve para armazenamento de dados em memória e também é possível persistí-los em disco, definir um tempo de vida para seus dados se necessário, habilitar failover, etc. Você poderá acessar o site associado a este repositório para entender o código fonte abaixo.",User,https://api.github.com/users/renematos79,https://github.com/renematos79,https://github.com/renematos79/redis,https://api.github.com/repos/renematos79/redis,False,2016-11-02T00:23:28Z,2016-12-28T21:21:10Z,4066,0,C#,True,False,0,0,0,0,1573082971,,,
144913455,rafabrayner/importador_licitacoes_municipais_sagres,This is an importer that converts CSV data in to a relational database MySql for the open data about municipal biddings that are available in the follow link: http://tce.pb.gov.br/servicos/dados-abertos-do-sagres-tce-pb. The goal of that project is that civil society can get those data in a better way that allow them to make more efficient searchs rather than searching in a CSV file.,User,https://api.github.com/users/rafabrayner,https://github.com/rafabrayner,https://github.com/rafabrayner/importador_licitacoes_municipais_sagres,https://api.github.com/repos/rafabrayner/importador_licitacoes_municipais_sagres,False,2018-08-15T23:35:12Z,2018-08-15T23:35:15Z,4,0,,True,True,0,0,0,0,1573082971,,,
157976636,Gabriellm2003/Coffee-CNN,"O crescimento da quantidade de dados gerados é evidente em nossa sociedade, e esses dados variam desde tabelas a até mesmo relatórios e imagens. Devido a essa grande quantidade de dados, o rumo natural e favorável em que a literatura decidiu seguir é o de modelos orientados a dados. Porém ao se tratar de imagens, utilizar modelos orientados a dados pode ser complicado, pois em uma imagem podem existir uma grande quantidade de classes e indentificar todas elas antes de treinar um determinado modelo pode ser uma tarefa inviável.   Para contornar o problema descrito, surgiu uma abordagem conhecida como cenário aberto, que tenta abstrair a existência de múltiplas classes em um deteminado problema, tendo foco somente nas classes relevantes, sendo as outras ditas como 'desconhecidas'.  Esse trabalho consiste na adaptação de um modelo de aprendizado profundo para limiarização de plantações de café para uma abordagem de cenário semi-aberto e completamente aberto, utilizando como discriminador de classes o hiperparâmetro threshold. E para definir esse parâmetro foi proposto um estimador.",User,https://api.github.com/users/Gabriellm2003,https://github.com/Gabriellm2003,https://github.com/Gabriellm2003/Coffee-CNN,https://api.github.com/repos/Gabriellm2003/Coffee-CNN,False,2018-11-17T11:10:41Z,2018-12-06T10:55:17Z,7012,0,Python,True,True,0,0,0,0,1573082971,,,
197003524,Pinalli/ibm-atm-challenge,"IBM ATM Challenge Você deve criar uma API de Caixa ATM, onde deve ser possível executar operações de saque, depósito, transferência, extrato e produzir um relatório de fechamento, além de operações e controles que forem necessários. Para as operações estarem disponíveis o caixa deve estar aberto, ou seja, deve ser previsto operações de abertura e fechamento de caixa. Saque Para operações de saque, devem ser informados os dados necessários como entrada da operação, e retornar as cédulas que serão retiradas do caixa, além de dados complementares em caso de necessidade. Depósito Para operações de depósito, devem ser informados os dados necessários como entrada da operação, além do tipo de depósito (DINHEIRO, CHEQUE) e retornar os dados necessários para o comprovante. Transferência Para operações de transferência, devem ser informados os dados necessários para a operação das contas origem e destino, com cenários de validação de saldo e possibilidade de agendamento. Como entregar estes desafios Você deve forkar este projeto e fazer o push no seu próprio repositório e enviar o link para o email do recrutador, junto com seu LinkedIn atualizado. A implementação deve ficar na pasta correspondente ao desafio. Fique à vontade para adicionar qualquer tipo de conteúdo que julgue útil ao projeto, alterar/acrescentar um README com instruções de como executá-lo, etc. Critérios de Avaliação Clean code; Scalability/Performance; Flexibility/Extensibility; SOC (Separation of Concerns); Tratamento de erros e exceções; Lógica utilizada para a resolução do exercício. Observação: Deve-se utilizar linguagem Java em versões 8+; A aplicação deve ser em SpringBoot conforme template deste repositório; Você não deve fazer um Pull Request para este projeto! Extras Utilização do Docker; Programação Funcional; Testes unitários ou de integração; Explique o processo de resolução do desafio; Regras de sugestão de cédulas para melhor distribuição e disponibilidade no caixa; Banco de dados, contemplando os dados de contas corrente e informações de cada operação realizada.",User,https://api.github.com/users/Pinalli,https://github.com/Pinalli,https://github.com/Pinalli/ibm-atm-challenge,https://api.github.com/repos/Pinalli/ibm-atm-challenge,False,2019-07-15T13:24:31Z,2019-07-15T13:28:06Z,3,0,,True,True,0,0,0,0,1573082971,,,
